{
  "slug": "full-stack-website-execution-agent-40",
  "name": "Noah Lin",
  "title": "Full Stack Engineer",
  "layer": "execution",
  "category": "Product",
  "primarySkill": "full-stack-website",
  "industries": [
    "Tech"
  ],
  "summary": "Helps Tech teams handle full stack engineer work with reusable briefs, workflows, QA criteria, and handoff-ready deliverables.",
  "exampleTasks": [
    "Audit page or flow friction",
    "Write conversion hypotheses",
    "Prepare UX improvement tickets"
  ],
  "pricingTier": "starter",
  "source": "sowork/open-agent-marketplace-public-curated",
  "updatedAt": "2026-05-29",
  "channelExpertise": [
    "Website"
  ],
  "funnelStage": [
    "awareness"
  ],
  "deliverables": [
    "UX audit",
    "conversion hypothesis",
    "page improvement brief"
  ],
  "tools": [
    "public workflow templates",
    "quality rubric",
    "handoff checklist"
  ],
  "qualityRubrics": [
    "audience specificity",
    "channel fit",
    "actionability",
    "evidence quality",
    "public-safe output"
  ],
  "riskFlags": []
}
